{
  "$schema": "https://json-schema.org/draft/2020-12/schema",
  "$id": "https://tastecheck.dev/contracts/v1/release-effectiveness-terminal-v5.schema.json",
  "title": "Immutable terminal V5 effectiveness projection",
  "type": "object",
  "additionalProperties": false,
  "required": ["schema_version", "kind", "source_evidence_sha256", "effectiveness_status", "release_eligible", "mean_delta", "threshold", "preference", "immutable_stop_rule"],
  "properties": {
    "schema_version": { "const": 1 },
    "kind": { "const": "immutable-terminal-v5-effectiveness-projection" },
    "source_evidence_sha256": { "const": "1bf66f612098df398163042e2450ed6eb6ee4b0a3b57d73e1aebbe76196b1d81" },
    "effectiveness_status": { "const": "blocked" },
    "release_eligible": { "const": false },
    "mean_delta": { "const": 0.3 },
    "threshold": { "const": 0.6 },
    "preference": {
      "type": "object",
      "additionalProperties": false,
      "required": ["current", "total"],
      "properties": {
        "current": { "const": 11 },
        "total": { "const": 12 }
      }
    },
    "immutable_stop_rule": { "const": true }
  }
}
